{
  "schemaVersion": "ios-snapshot-convergence.v1",
  "issue": "#2189",
  "parent": "#2188",
  "references": {
    "deepButton": "#1626",
    "appMount": "#1571"
  },
  "runId": "ios-snapshot-1788273123733-69649",
  "generatedAt": "2026-09-01T14:32:03.733Z",
  "revision": {
    "commit": "955ed760e4563f181db91ffe719ba74e827e21bf",
    "branch": "codex/2189-ios-snapshot-baselines",
    "dirty": false
  },
  "toolchain": {
    "node": "v26.7.0",
    "pnpm": "11.19.0",
    "xcode": "Xcode 27.0\nBuild version 27A5252f",
    "simctl": "@(#)PROGRAM:simctl  PROJECT:CoreSimulator-1171.6",
    "os": "darwin 27.0.0",
    "arch": "arm64"
  },
  "target": {
    "platform": "ios",
    "kind": "simulator",
    "udid": "7E76ECA9-D40C-4833-A711-F870F8CE9363",
    "name": "bench-golden-v2",
    "runtime": "com.apple.CoreSimulator.SimRuntime.iOS-27-0",
    "appId": "com.callstack.agentdevicelab",
    "appPath": "/private/tmp/agent-device-2189-fixture-app-repacked/AgentDeviceTester.app"
  },
  "config": {
    "warmSampleMinimum": 20,
    "coldSampleMinimum": 10,
    "requestedSamples": 10,
    "screens": ["quiet", "list", "nested-scroll", "alert", "system-surface", "xctest-stress"],
    "states": ["cold-cold", "cold"]
  },
  "measurements": [
    {
      "transport": "local",
      "execution": "fresh-process-cli",
      "state": "cold-cold",
      "screen": "quiet",
      "sampleMinimum": 10,
      "operation": "open-foreground",
      "samples": [
        {
          "index": 1,
          "startedAt": "2026-09-01T13:49:31.613Z",
          "finishedAt": "2026-09-01T13:49:49.765Z",
          "operation": "open-foreground",
          "wallClockMs": 18152.004542000002,
          "daemonDurationMs": 16557,
          "responseBytes": 4798,
          "nodeCount": 6,
          "targetGeneration": 589381,
          "firstTree": "readable",
          "ok": true,
          "outlier": false
        },
        {
          "index": 2,
          "startedAt": "2026-09-01T13:50:00.222Z",
          "finishedAt": "2026-09-01T13:50:18.433Z",
          "operation": "open-foreground",
          "wallClockMs": 18211.438791999994,
          "daemonDurationMs": 16666,
          "responseBytes": 4799,
          "nodeCount": 6,
          "targetGeneration": 559449,
          "firstTree": "readable",
          "ok": true,
          "outlier": false
        },
        {
          "index": 3,
          "startedAt": "2026-09-01T13:50:29.214Z",
          "finishedAt": "2026-09-01T13:50:46.850Z",
          "operation": "open-foreground",
          "wallClockMs": 17635.599959,
          "daemonDurationMs": 15996,
          "responseBytes": 4798,
          "nodeCount": 6,
          "targetGeneration": 328184,
          "firstTree": "readable",
          "ok": true,
          "outlier": false
        },
        {
          "index": 4,
          "startedAt": "2026-09-01T13:50:57.309Z",
          "finishedAt": "2026-09-01T13:51:15.661Z",
          "operation": "open-foreground",
          "wallClockMs": 18352.144959000012,
          "daemonDurationMs": 15228,
          "responseBytes": 4798,
          "nodeCount": 6,
          "targetGeneration": 940108,
          "firstTree": "readable",
          "ok": true,
          "outlier": false
        },
        {
          "index": 5,
          "startedAt": "2026-09-01T13:51:26.811Z",
          "finishedAt": "2026-09-01T13:51:45.294Z",
          "operation": "open-foreground",
          "wallClockMs": 18483.030666000006,
          "daemonDurationMs": 16742,
          "responseBytes": 4799,
          "nodeCount": 6,
          "targetGeneration": 405069,
          "firstTree": "readable",
          "ok": true,
          "outlier": false
        },
        {
          "index": 6,
          "startedAt": "2026-09-01T13:51:55.877Z",
          "finishedAt": "2026-09-01T13:52:14.434Z",
          "operation": "open-foreground",
          "wallClockMs": 18557.21095900002,
          "daemonDurationMs": 16758,
          "responseBytes": 4799,
          "nodeCount": 6,
          "targetGeneration": 123656,
          "firstTree": "readable",
          "ok": true,
          "outlier": false
        },
        {
          "index": 7,
          "startedAt": "2026-09-01T13:52:24.355Z",
          "finishedAt": "2026-09-01T13:52:45.009Z",
          "operation": "open-foreground",
          "wallClockMs": 20653.81916700001,
          "daemonDurationMs": 19189,
          "responseBytes": 4798,
          "nodeCount": 6,
          "targetGeneration": 617722,
          "firstTree": "readable",
          "ok": true,
          "outlier": false
        },
        {
          "index": 8,
          "startedAt": "2026-09-01T13:52:57.220Z",
          "finishedAt": "2026-09-01T13:53:17.641Z",
          "operation": "open-foreground",
          "wallClockMs": 20420.928583,
          "daemonDurationMs": 18367,
          "responseBytes": 4798,
          "nodeCount": 6,
          "targetGeneration": 413979,
          "firstTree": "readable",
          "ok": true,
          "outlier": false
        },
        {
          "index": 9,
          "startedAt": "2026-09-01T13:53:28.562Z",
          "finishedAt": "2026-09-01T13:53:49.691Z",
          "operation": "open-foreground",
          "wallClockMs": 21128.663,
          "daemonDurationMs": 19497,
          "responseBytes": 4798,
          "nodeCount": 6,
          "targetGeneration": 573888,
          "firstTree": "readable",
          "ok": true,
          "outlier": false
        },
        {
          "index": 10,
          "startedAt": "2026-09-01T13:54:00.042Z",
          "finishedAt": "2026-09-01T13:54:20.932Z",
          "operation": "open-foreground",
          "wallClockMs": 20888.94329200004,
          "daemonDurationMs": 18936,
          "responseBytes": 4799,
          "nodeCount": 6,
          "targetGeneration": 866325,
          "firstTree": "readable",
          "ok": true,
          "outlier": false
        }
      ],
      "wallClockMs": {
        "n": 10,
        "min": 17635.599959,
        "median": 18483.030666000006,
        "p95": 21128.663,
        "max": 21128.663,
        "outlierCount": 0,
        "outlierRule": "tukey-1.5-iqr"
      },
      "daemonDurationMs": {
        "n": 10,
        "min": 15228,
        "median": 16742,
        "p95": 19497,
        "max": 19497,
        "outlierCount": 0,
        "outlierRule": "tukey-1.5-iqr"
      },
      "responseBytes": {
        "n": 10,
        "min": 4798,
        "median": 4798,
        "p95": 4799,
        "max": 4799,
        "outlierCount": 0,
        "outlierRule": "tukey-1.5-iqr"
      },
      "failures": 0,
      "failureCategories": {}
    },
    {
      "transport": "local",
      "execution": "fresh-process-cli",
      "state": "cold-cold",
      "screen": "list",
      "sampleMinimum": 10,
      "operation": "open-foreground",
      "samples": [
        {
          "index": 1,
          "startedAt": "2026-09-01T13:54:30.525Z",
          "finishedAt": "2026-09-01T13:54:52.241Z",
          "operation": "open-foreground",
          "wallClockMs": 21715.605709000025,
          "daemonDurationMs": 19914,
          "responseBytes": 16905,
          "nodeCount": 35,
          "targetGeneration": 232020,
          "firstTree": "readable",
          "ok": true,
          "outlier": false
        },
        {
          "index": 2,
          "startedAt": "2026-09-01T13:55:03.145Z",
          "finishedAt": "2026-09-01T13:55:23.399Z",
          "operation": "open-foreground",
          "wallClockMs": 20253.754709,
          "daemonDurationMs": 18381,
          "responseBytes": 16905,
          "nodeCount": 35,
          "targetGeneration": 145068,
          "firstTree": "readable",
          "ok": true,
          "outlier": false
        },
        {
          "index": 3,
          "startedAt": "2026-09-01T13:55:34.610Z",
          "finishedAt": "2026-09-01T13:55:54.100Z",
          "operation": "open-foreground",
          "wallClockMs": 19489.117750000034,
          "daemonDurationMs": 17752,
          "responseBytes": 16906,
          "nodeCount": 35,
          "targetGeneration": 442081,
          "firstTree": "readable",
          "ok": true,
          "outlier": false
        },
        {
          "index": 4,
          "startedAt": "2026-09-01T13:56:05.387Z",
          "finishedAt": "2026-09-01T13:56:24.967Z",
          "operation": "open-foreground",
          "wallClockMs": 19580.262999999977,
          "daemonDurationMs": 17560,
          "responseBytes": 16906,
          "nodeCount": 35,
          "targetGeneration": 131119,
          "firstTree": "readable",
          "ok": true,
          "outlier": false
        },
        {
          "index": 5,
          "startedAt": "2026-09-01T13:56:35.589Z",
          "finishedAt": "2026-09-01T13:56:56.192Z",
          "operation": "open-foreground",
          "wallClockMs": 20601.880999999994,
          "daemonDurationMs": 18606,
          "responseBytes": 16906,
          "nodeCount": 35,
          "targetGeneration": 683059,
          "firstTree": "readable",
          "ok": true,
          "outlier": false
        },
        {
          "index": 6,
          "startedAt": "2026-09-01T13:57:07.411Z",
          "finishedAt": "2026-09-01T13:57:29.169Z",
          "operation": "open-foreground",
          "wallClockMs": 21757.57912499999,
          "daemonDurationMs": 19724,
          "responseBytes": 16905,
          "nodeCount": 35,
          "targetGeneration": 669058,
          "firstTree": "readable",
          "ok": true,
          "outlier": false
        },
        {
          "index": 7,
          "startedAt": "2026-09-01T13:57:40.479Z",
          "finishedAt": "2026-09-01T13:58:00.613Z",
          "operation": "open-foreground",
          "wallClockMs": 20133.741125,
          "daemonDurationMs": 18359,
          "responseBytes": 16905,
          "nodeCount": 35,
          "targetGeneration": 411484,
          "firstTree": "readable",
          "ok": true,